{
  "_FICTIONAL": "ALL DATA IN THIS EXAMPLE IS FICTIONAL. Not a real project, company, or person.",
  "schema_version": "1.0",
  "brief_id": "brief_linden_yard_2026-10-06_v1",
  "run_id": "run_2026-10-06_linden_yard",
  "version": 1,
  "org_id": "1befe790-aca8-5579-92e3-e97c76435686",
  "project_id": "f9fdf464-52c4-5d02-a931-c76a025e916c",
  "project_name": "Linden Yard Apartments",
  "as_of": "2026-10-06",
  "coverage": {
    "window_start": "2026-10-06T00:00:00-04:00",
    "window_end": "2026-10-06T23:59:59-04:00",
    "cutoff_at": "2026-10-07T04:46:00-04:00"
  },
  "generated_at": "2026-10-07T05:52:00-04:00",
  "compare_to": {
    "as_of": "2026-10-05",
    "brief_id": "brief_linden_yard_2026-10-05_v1",
    "basis": "prior_business_day_snapshot"
  },
  "freshness": [
    {
      "source": "procore",
      "system": "procore_dmsa",
      "band": "fresh",
      "as_of_label": "Procore synced Wed 10/7 4:46 AM",
      "last_successful_sync": "2026-10-07T04:46:00-04:00"
    },
    {
      "source": "msgraph_outlook",
      "band": "fresh",
      "as_of_label": "Project mailbox synced Wed 10/7 4:41 AM",
      "last_successful_sync": "2026-10-07T04:41:00-04:00",
      "scope_note": "Only lindenyard@larkspurdev.example. Threads that don't copy this mailbox are invisible."
    },
    {
      "source": "schedule",
      "system": "p6_xer",
      "band": "aging",
      "as_of_label": "Schedule as of XER data date Mon 9/28 (uploaded Fri 10/2)",
      "last_successful_sync": "2026-10-02T15:05:00-04:00",
      "data_date": "2026-09-28",
      "uploaded_at": "2026-10-02T15:05:00-04:00",
      "schedule_update_id": "U2",
      "effect": "Schedule-derived float and TCO effects are capped at Likely unless a fresher record corroborates them"
    },
    {
      "source": "msgraph_sharepoint",
      "band": "fresh",
      "as_of_label": "Contract terms CT-1/CT-2 confirmed by GC 9/15",
      "last_successful_sync": "2026-10-07T04:41:00-04:00"
    }
  ],
  "status": {
    "health": "at_risk",
    "health_rule": "Near-critical exposure >= 3 days (items 1, 2, 6). No Confirmed critical-path delay yet",
    "milestone": {
      "name": "TCO",
      "activity_ref": "p6:activity:A4000",
      "baseline": "2027-08-27",
      "forecast": "2027-08-27",
      "delta_cd": 0,
      "basis": "XER 9/28 (aging)",
      "exposure_note": "Up to +9 wd if items 1 or 2 miss Fri 10/9"
    },
    "net_new_cost_exposure": {
      "recognized_usd": 145000,
      "at_risk_usd": 19460,
      "text": "+$145k recognized (CE-031); +$19.5k escalation if PO-0117 slips past 10/9"
    },
    "decisions_needed_this_week": 4,
    "items_flagged": 13,
    "items_shown": 7,
    "lines": [
      "AT RISK: TCO Aug 27, 2027 holds on the 9/28 schedule; two Fri 10/9 deadlines each add 7-9 wd if missed.",
      "Cost: +$145k recognized (CE-031); owner contingency 92% committed at 46% complete.",
      "4 decisions this week \u00b7 13 items flagged, top 7 shown"
    ]
  },
  "top_items": [
    {
      "item_id": "T1",
      "rank": 1,
      "tag": "NEW",
      "section": "procurement_issues",
      "playbook_rule_ids": [
        "PB-03",
        "PB-04"
      ],
      "headline": "Switchgear PO-0117 still in Draft; quote expires Fri 10/9, then lead time grows 2 weeks",
      "body": "Quote ($486,500, 30-week lead) holds through 10/9; after that +4% ($19.5k) and 32 weeks. Submittal approved 9/18; OAC 14.06 had the PO due 9/30. A3050 float fell 15 to 10 wd and loses ~1 wd per workday unissued (~4 wd now). If missed: ~9 wd to TCO (~$224k) plus escalation.",
      "confidence": "Likely",
      "confidence_note": "PO status and quote terms Confirmed; float estimate extrapolated past the 9/28 XER data date",
      "impact": {
        "schedule": {
          "milestone_wd": 9,
          "milestone_cd": 14,
          "float_consumed_wd": 6,
          "activity_refs": [
            "p6:activity:A3050",
            "p6:activity:A3100"
          ],
          "condition": "PO not issued by 2026-10-09",
          "label": "Likely"
        },
        "cost": {
          "usd_low": 19460,
          "usd_high": 19460,
          "kind": "escalation",
          "label": "Confirmed"
        },
        "delay_usd": 224000,
        "method": "TF 10 wd at DD 9/28 minus 9 workdays to 10/9 = 1 wd; +10 wd lead after expiry => 9 wd beyond float; TCO 2027-08-27 -> 2027-09-10 = 14 cd x $16,000"
      },
      "decision_deadline": {
        "date": "2026-10-09",
        "kind": "quote_expiry"
      },
      "score": {
        "value": 189892,
        "p": 0.6,
        "urgency": 1.25,
        "floor": null
      },
      "owner": {
        "name": "Lauren Pike",
        "role": "GC Procurement Manager",
        "company": "Ironbridge Builders"
      },
      "co_owners": [
        {
          "name": "Priya Nair",
          "role": "GC Senior PM",
          "company": "Ironbridge Builders"
        }
      ],
      "action": {
        "text": "Issue PO-0117 at quoted price and lead time",
        "due": "2026-10-08",
        "definition_of_done": "Executed PO plus factory acknowledgment showing ship week"
      },
      "citations": [
        {
          "ref": "procore:commitment:3401",
          "label": "PO-0117 Ampere Supply (Draft)",
          "fields": [
            "status",
            "quote_terms"
          ]
        },
        {
          "ref": "msgraph_outlook:message:msg_E101",
          "label": "Email: Ampere Supply 10/5 11:20 AM",
          "quote": "After 10/9 we have to re-quote: expect about +4% and a 32-week lead time"
        },
        {
          "ref": "procore:submittal:6301",
          "label": "Submittal 26 24 13-001 (Approved as Noted 9/18)",
          "fields": [
            "approvers[0].returned_date"
          ]
        },
        {
          "ref": "procore:meeting_item:991403",
          "label": "OAC #14 item 14.06"
        },
        {
          "ref": "p6:activity:A3050",
          "label": "A3050 Procure Switchgear",
          "fields": [
            "total_float_wd"
          ],
          "as_of": "XER data date 2026-09-28"
        }
      ],
      "freshness_sources": [
        "procore",
        "msgraph_outlook",
        "schedule"
      ]
    },
    {
      "item_id": "T2",
      "rank": 2,
      "tag": "WORSE",
      "section": "schedule_risks",
      "playbook_rule_ids": [
        "PB-01",
        "PB-02"
      ],
      "finding_ids": [
        "1733cb4a-526a-58e6-a679-4ba453eae9cc",
        "26b99c14-c918-5e13-815d-5175234258f7",
        "74d1b6d5-84fa-5535-b90e-e82adc3b6352"
      ],
      "delta_text": "New today: fabricator release deadline of Fri 10/9. Shop drawing review now 5 days overdue (was 4); severity raised to high",
      "headline": "Transfer steel: RFI 42 and shop drawings must clear by Fri 10/9 or delivery slips 2 weeks",
      "body": "RFI 42 (embeds, Grid C/4-7) is 7 days overdue and shop drawings rev 1 are 5 days overdue, both with Tandem. Bayline says a missed 10/9 release moves its shop slot to Oct 26 and delivery from Nov 9 to ~Nov 23. A1225/A1230 float fell 8 to 3 wd, so TCO would move ~7 wd (~$192k).",
      "confidence": "Likely",
      "confidence_note": "Overdue days and fabricator dates Confirmed; TCO effect uses the 9/28 XER (aging), corroborated by today's fabricator email",
      "impact": {
        "schedule": {
          "milestone_wd": 7,
          "milestone_cd": 12,
          "float_consumed_wd": 5,
          "activity_refs": [
            "p6:activity:A1225",
            "p6:activity:A1230"
          ],
          "condition": "release missed on 2026-10-09",
          "label": "Likely"
        },
        "delay_usd": 192000,
        "method": "Delivery slip 10 wd (Nov 9 -> ~Nov 23) minus TF 3 wd = 7 wd; TCO 2027-08-27 -> 2027-09-08 = 12 cd x $16,000"
      },
      "decision_deadline": {
        "date": "2026-10-09",
        "kind": "fabricator_release"
      },
      "score": {
        "value": 144000,
        "p": 0.6,
        "urgency": 1.25,
        "floor": "critical_path"
      },
      "owner": {
        "name": "Raj Mehta",
        "role": "Structural EOR",
        "company": "Tandem Structural Engineers"
      },
      "co_owners": [
        {
          "name": "Priya Nair",
          "role": "GC Senior PM",
          "company": "Ironbridge Builders"
        }
      ],
      "action": {
        "text": "Answer RFI 42 and return rev 1; GC escalates today, asks Bayline about releasing non-embed members",
        "due": "2026-10-08",
        "definition_of_done": "RFI 42 closed and rev 1 returned, with release to Bayline confirmed in writing"
      },
      "citations": [
        {
          "ref": "procore:rfi:9042",
          "label": "RFI #42",
          "fields": [
            "status",
            "due_date",
            "ball_in_court",
            "schedule_impact.status"
          ]
        },
        {
          "ref": "procore:submittal:6103",
          "label": "Submittal 05 12 00-003 rev 1",
          "fields": [
            "status.name",
            "received_date",
            "due_date",
            "ball_in_court"
          ]
        },
        {
          "ref": "msgraph_outlook:message:msg_E104",
          "label": "Email: Bayline Steel 10/6 8:12 AM",
          "quote": "the next available slot is Oct 26, which pushes delivery of the transfer steel from Nov 9 to approximately Nov 23"
        },
        {
          "ref": "p6:activity:A1225",
          "label": "A1225 Fabricate Transfer Steel",
          "fields": [
            "total_float_wd"
          ],
          "as_of": "XER data date 2026-09-28"
        },
        {
          "ref": "p6:activity:A1230",
          "label": "A1230 Erect Transfer Steel",
          "fields": [
            "total_float_wd"
          ],
          "as_of": "XER data date 2026-09-28"
        },
        {
          "ref": "procore:meeting_item:991402",
          "label": "OAC #14 item 14.05 (due 10/2, open)"
        }
      ],
      "freshness_sources": [